{
  "schema": "org.properlinux.catalogue",
  "version": 2,
  "generated": "2026-08-31",
  "entries": [
    {
      "id": "chromium", "name": "Chromium", "kind": "application", "category": "Browsers",
      "description": "Proper's fast, open-source default web browser.", "homepage": "https://www.chromium.org/",
      "source_url": "https://packages.fedoraproject.org/pkgs/chromium/chromium/", "provider": "fedora", "provider_id": "chromium",
      "status": "Fedora-maintained", "license": "BSD-3-Clause and component licences", "architectures": ["x86_64"],
      "icon": "chromium-browser", "accent": "#4C8BF5", "recommended": true, "removable": false, "validated": "2026-08-31",
      "tags": ["web", "default", "browser"], "detection": {"type": "rpm", "value": "chromium"}, "launch_args": ["chromium-browser"]
    },
    {
      "id": "google-chrome", "name": "Google Chrome", "kind": "application", "category": "Browsers",
      "description": "Google's supported browser with account sync and proprietary media support.", "homepage": "https://www.google.com/chrome/",
      "source_url": "https://www.google.com/chrome/", "provider": "vendor", "provider_id": "google-chrome-stable",
      "status": "Official Google package", "license": "Proprietary", "architectures": ["x86_64"],
      "icon": "google-chrome", "accent": "#4285F4", "recommended": true, "removable": true, "validated": "2026-08-31",
      "detection": {"type": "command", "value": "google-chrome"},
      "install_steps": [{"program": "dnf", "args": ["install", "-y", "https://dl.google.com/linux/direct/google-chrome-stable_current_x86_64.rpm"], "privileged": true}],
      "uninstall_steps": [{"program": "dnf", "args": ["remove", "-y", "google-chrome-stable"], "privileged": true}],
      "launch_args": ["google-chrome"]
    },
    {
      "id": "brave", "name": "Brave", "kind": "application", "category": "Browsers",
      "description": "A privacy-focused Chromium browser with built-in blocking.", "homepage": "https://brave.com/linux/",
      "source_url": "https://flathub.org/apps/com.brave.Browser", "provider": "flatpak", "provider_id": "com.brave.Browser",
      "status": "Flathub catalogue", "license": "MPL-2.0 and component licences", "architectures": ["x86_64"],
      "icon": "com.brave.Browser", "accent": "#FB542B", "recommended": false, "removable": true, "validated": "2026-08-31",
      "detection": {"type": "flatpak", "value": "com.brave.Browser"}, "launch_args": ["flatpak", "run", "com.brave.Browser"]
    },
    {
      "id": "microsoft-edge", "name": "Microsoft Edge", "kind": "application", "category": "Browsers",
      "description": "Microsoft's Chromium browser for work and Microsoft services.", "homepage": "https://www.microsoft.com/edge/download",
      "source_url": "https://flathub.org/apps/com.microsoft.Edge", "provider": "flatpak", "provider_id": "com.microsoft.Edge",
      "status": "Flathub catalogue", "license": "Proprietary", "architectures": ["x86_64"],
      "icon": "com.microsoft.Edge", "accent": "#0AA0F6", "recommended": false, "removable": true, "validated": "2026-08-31",
      "detection": {"type": "flatpak", "value": "com.microsoft.Edge"}, "launch_args": ["flatpak", "run", "com.microsoft.Edge"]
    },
    {
      "id": "firefox", "name": "Firefox", "kind": "application", "category": "Browsers",
      "description": "Mozilla's independent, privacy-respecting web browser.", "homepage": "https://www.mozilla.org/firefox/",
      "source_url": "https://packages.fedoraproject.org/pkgs/firefox/firefox/", "provider": "fedora", "provider_id": "firefox",
      "status": "Fedora-maintained", "license": "MPL-2.0 and component licences", "architectures": ["x86_64"],
      "icon": "firefox", "accent": "#FF7139", "recommended": false, "removable": false, "validated": "2026-08-31",
      "caveat": "Retained as an unpromoted fallback for Fedora's live installer path.",
      "detection": {"type": "rpm", "value": "firefox"}, "launch_args": ["firefox"]
    },
    {
      "id": "zen-browser", "name": "Zen Browser", "kind": "application", "category": "Browsers",
      "description": "A calm Firefox-based browser with vertical tabs and split views.", "homepage": "https://zen-browser.app/",
      "source_url": "https://flathub.org/apps/app.zen_browser.zen", "provider": "flatpak", "provider_id": "app.zen_browser.zen",
      "status": "Flathub catalogue", "license": "MPL-2.0 and component licences", "architectures": ["x86_64"],
      "icon": "app.zen_browser.zen", "accent": "#7B70F5", "recommended": true, "removable": true, "validated": "2026-08-31",
      "detection": {"type": "flatpak", "value": "app.zen_browser.zen"}, "launch_args": ["flatpak", "run", "app.zen_browser.zen"]
    },
    {
      "id": "discord", "name": "Discord", "kind": "application", "category": "Communication",
      "description": "Voice, video, and community chat.", "homepage": "https://discord.com/",
      "source_url": "https://flathub.org/apps/com.discordapp.Discord", "provider": "flatpak", "provider_id": "com.discordapp.Discord",
      "status": "Community-maintained Flathub package", "license": "Proprietary", "architectures": ["x86_64"],
      "icon": "com.discordapp.Discord", "accent": "#5865F2", "recommended": true, "removable": true, "validated": "2026-08-31",
      "detection": {"type": "flatpak", "value": "com.discordapp.Discord"}, "launch_args": ["flatpak", "run", "com.discordapp.Discord"]
    },
    {
      "id": "slack", "name": "Slack", "kind": "application", "category": "Communication",
      "description": "Team messaging and collaboration for Slack workspaces.", "homepage": "https://slack.com/intl/en-gb/downloads/linux",
      "source_url": "https://flathub.org/apps/com.slack.Slack", "provider": "flatpak", "provider_id": "com.slack.Slack",
      "status": "Community-maintained Flathub package", "license": "Proprietary", "architectures": ["x86_64"],
      "icon": "com.slack.Slack", "accent": "#4A154B", "recommended": false, "removable": true, "validated": "2026-08-31",
      "detection": {"type": "flatpak", "value": "com.slack.Slack"}, "launch_args": ["flatpak", "run", "com.slack.Slack"]
    },
    {
      "id": "signal", "name": "Signal", "kind": "application", "category": "Communication",
      "description": "Private, end-to-end encrypted messaging and calling.", "homepage": "https://signal.org/download/",
      "source_url": "https://flathub.org/apps/org.signal.Signal", "provider": "flatpak", "provider_id": "org.signal.Signal",
      "status": "Flathub catalogue", "license": "AGPL-3.0-only client", "architectures": ["x86_64"],
      "icon": "org.signal.Signal", "accent": "#3A76F0", "recommended": true, "removable": true, "validated": "2026-08-31",
      "detection": {"type": "flatpak", "value": "org.signal.Signal"}, "launch_args": ["flatpak", "run", "org.signal.Signal"]
    },
    {
      "id": "telegram", "name": "Telegram", "kind": "application", "category": "Communication",
      "description": "Fast cloud messaging with groups, channels, and calls.", "homepage": "https://desktop.telegram.org/",
      "source_url": "https://flathub.org/apps/org.telegram.desktop", "provider": "flatpak", "provider_id": "org.telegram.desktop",
      "status": "Flathub catalogue", "license": "GPL-3.0-or-later client", "architectures": ["x86_64"],
      "icon": "org.telegram.desktop", "accent": "#2AABEE", "recommended": false, "removable": true, "validated": "2026-08-31",
      "detection": {"type": "flatpak", "value": "org.telegram.desktop"}, "launch_args": ["flatpak", "run", "org.telegram.desktop"]
    },
    {
      "id": "zoom", "name": "Zoom", "kind": "application", "category": "Communication",
      "description": "Video meetings, screen sharing, and webinars.", "homepage": "https://zoom.us/download?os=linux",
      "source_url": "https://flathub.org/apps/us.zoom.Zoom", "provider": "flatpak", "provider_id": "us.zoom.Zoom",
      "status": "Community-maintained Flathub package", "license": "Proprietary", "architectures": ["x86_64"],
      "icon": "us.zoom.Zoom", "accent": "#2D8CFF", "recommended": false, "removable": true, "validated": "2026-08-31",
      "detection": {"type": "flatpak", "value": "us.zoom.Zoom"}, "launch_args": ["flatpak", "run", "us.zoom.Zoom"]
    },
    {
      "id": "vlc", "name": "VLC media player", "kind": "application", "category": "Media",
      "description": "The dependable player for video, music, discs, streams, and unusual formats.", "homepage": "https://www.videolan.org/vlc/",
      "source_url": "https://packages.fedoraproject.org/pkgs/vlc/vlc/", "provider": "fedora", "provider_id": "vlc",
      "status": "Fedora-maintained", "license": "GPL-2.0-or-later and component licences", "architectures": ["x86_64"],
      "icon": "vlc", "accent": "#FF8800", "recommended": true, "removable": true, "validated": "2026-08-31",
      "detection": {"type": "rpm", "value": "vlc"}, "launch_args": ["vlc"]
    },
    {
      "id": "spotify", "name": "Spotify", "kind": "application", "category": "Media",
      "description": "Music, podcasts, playlists, and Spotify Connect.", "homepage": "https://www.spotify.com/download/linux/",
      "source_url": "https://flathub.org/apps/com.spotify.Client", "provider": "flatpak", "provider_id": "com.spotify.Client",
      "status": "Community-maintained Flathub package", "license": "Proprietary", "architectures": ["x86_64"],
      "icon": "com.spotify.Client", "accent": "#1DB954", "recommended": true, "removable": true, "validated": "2026-08-31",
      "detection": {"type": "flatpak", "value": "com.spotify.Client"}, "launch_args": ["flatpak", "run", "com.spotify.Client"]
    },
    {
      "id": "obs-studio", "name": "OBS Studio", "kind": "application", "category": "Media",
      "description": "Record and stream your screen, camera, and audio.", "homepage": "https://obsproject.com/",
      "source_url": "https://flathub.org/apps/com.obsproject.Studio", "provider": "flatpak", "provider_id": "com.obsproject.Studio",